{
  "$schema": "http://json-schema.org/draft-04/schema#",

  "type": "object",
  "properties": {
    "id": { "type": "number" },
    "name": { "type": "string" },
    "nodes" : {
      "tags": {
        "type": "array",
        "items": { "$ref": "flow-schema-defs.json#/definitions/nodeInFlow" }
      }
    },
    "forms" : {
      "tags": {
        "type": "array",
        "items": {
            "type": "string"
        }
      }
    }
  },
  "required": ["id", "nodes"]
}